<?xml version="1.0" encoding="UTF-8"?>
<PHPDeps xmlns:xsi="http://www.w3.org/2001/XMLSchema-instance" xsi:noNamespaceSchemaLocation="../../../../phpdeps.xsd">
    <Modules>
        <Module>
            <Name>Module1</Name>
            <Namespace>Vendor\Library\Module1</Namespace>
            <Path>./Module1</Path>
        </Module>
        <Module>
            <Name>Module2</Name>
            <Namespace>Vendor\Library\Module2</Namespace>
            <Path>./Module2</Path>
        </Module>
    </Modules>
</PHPDeps>
