<?xml version="1.0" encoding="UTF-8"?>
<PHPDeps xmlns:xsi="http://www.w3.org/2001/XMLSchema-instance" xsi:noNamespaceSchemaLocation="../../../src/PHPDeps/phpdeps.xsd">
    <Modules>
        <Module>
            <Name>Tokenizer</Name>
            <Namespace>Koriit\PHPDeps\Tokenizer</Namespace>
            <Path>./src/PHPDeps/Tokenizer</Path>
        </Module>

        <Module>
            <Name>Tokenizer</Name>
            <Namespace>Koriit\PHPDeps\Tokenizer</Namespace>
            <Path>./src/PHPDeps/Tokenizer.php</Path>
        </Module>
    </Modules>
</PHPDeps>
