<?xml version="1.0" encoding="UTF-8"?>
<PHPDeps xmlns:xsi="http://www.w3.org/2001/XMLSchema-instance"
           xsi:noNamespaceSchemaLocation="src/PHPDeps/phpdeps.xsd">
    <Modules>
        <Module>
            <Name>PHPDepsDependencies</Name>
            <Namespace>Koriit\PHPDeps\PHPDepsDependencies</Namespace>
            <Path>./src/PHPDeps/PHPDepsDependencies.php</Path>
        </Module>
        <Module>
            <Name>PHPDepsApplication</Name>
            <Namespace>Koriit\PHPDeps\PHPDepsApplication</Namespace>
            <Path>./src/PHPDeps/PHPDepsApplication.php</Path>
        </Module>
    </Modules>
    <Detectors>
        <ModuleDetector>
            <Namespace>Koriit\PHPDeps</Namespace>
            <Path>./src/PHPDeps</Path>
        </ModuleDetector>
    </Detectors>
</PHPDeps>
